{
  "$schema": "https://json-schema.org/draft/2020-12/schema",
  "$id": "https://nao1215.github.io/jsonize/schemas/mount/linux.json",
  "title": "mount/linux",
  "description": "mount listing on Linux (util-linux and BusyBox): \"fs on dir type fstype (options)\"",
  "x-jsonize": {
    "definition": "mount/linux",
    "version": 1
  },
  "type": "array",
  "items": {
    "type": "object",
    "properties": {
      "filesystem": {
        "type": "string"
      },
      "mount_point": {
        "type": "string"
      },
      "type": {
        "type": "string"
      },
      "options": {
        "type": "array",
        "items": {
          "type": "string"
        }
      }
    },
    "required": [
      "filesystem",
      "mount_point",
      "type",
      "options"
    ]
  }
}
