[
  {
    "filesystem": "tmpfs",
    "mount_point": "/run",
    "type": "tmpfs",
    "options": [
      "rw",
      "nosuid",
      "nodev",
      "size=12882672k",
      "nr_inodes=819200",
      "mode=755",
      "inode64"
    ]
  },
  {
    "filesystem": "/dev/nvme1n1p2",
    "mount_point": "/",
    "type": "ext4",
    "options": [
      "rw",
      "relatime"
    ]
  },
  {
    "filesystem": "devtmpfs",
    "mount_point": "/dev",
    "type": "devtmpfs",
    "options": [
      "rw",
      "nosuid",
      "size=32119780k",
      "nr_inodes=8029945",
      "mode=755",
      "inode64"
    ]
  },
  {
    "filesystem": "tmpfs",
    "mount_point": "/dev/shm",
    "type": "tmpfs",
    "options": [
      "rw",
      "nosuid",
      "nodev",
      "inode64",
      "usrquota"
    ]
  },
  {
    "filesystem": "devpts",
    "mount_point": "/dev/pts",
    "type": "devpts",
    "options": [
      "rw",
      "nosuid",
      "noexec",
      "relatime",
      "gid=5",
      "mode=600",
      "ptmxmode=000"
    ]
  }
]
